{
  "version": 1,
  "client_message_id": "33333333-3333-4333-8333-333333333333",
  "conversation_revision": "7",
  "recipient_set_revision": "bbbbbbbbbbbbbbbbbbbbbbbbbbbbbbbbbbbbbbbbbbbbbbbbbbbbbbbbbbbbbbbb",
  "recipients": [
    {"target_device_id": "22222222-2222-4222-8222-222222222222", "ciphertext": "REVNTyBUT0tFTg=="},
    {"target_device_id": "44444444-4444-4444-8444-444444444444", "ciphertext": "REVNTyBUT0tFTg=="},
    {"target_device_id": "55555555-5555-4555-8555-555555555555", "ciphertext": "REVNTyBUT0tFTg=="}
  ],
  "attachment_ids": ["66666666-6666-4666-8666-666666666666"]
}
