{
  "version": 1,
  "client_message_id": "11111111-1111-4111-8111-111111111111",
  "conversation_revision": "1",
  "recipient_set_revision": "aaaaaaaaaaaaaaaaaaaaaaaaaaaaaaaaaaaaaaaaaaaaaaaaaaaaaaaaaaaaaaaa",
  "recipients": [
    {
      "target_device_id": "22222222-2222-4222-8222-222222222222",
      "ciphertext": "REVNTyBUT0tFTg=="
    }
  ],
  "attachment_ids": []
}
